{
  "repository": [
    {
      "t": "XML_Compare_Utilities — VNext engineering repository",
      "u": "https://github.com/reallakshman19/XML_Compare_Utilities"
    }
  ],
  "issues": [
    {
      "t": "Normal/UI workstream #140",
      "u": "https://github.com/reallakshman19/XML_Compare_Utilities/issues/140"
    },
    {
      "t": "F01/Config independent review #152",
      "u": "https://github.com/reallakshman19/XML_Compare_Utilities/issues/152"
    }
  ],
  "pullRequests": [
    {
      "t": "A1 Policy-A writer PR #149 · DRAFT",
      "u": "https://github.com/reallakshman19/XML_Compare_Utilities/pull/149"
    },
    {
      "t": "Config successor PR #150 · DRAFT",
      "u": "https://github.com/reallakshman19/XML_Compare_Utilities/pull/150"
    }
  ],
  "roadmap": [
    {
      "t": "Original VNext project contract and acceptance plan",
      "u": "https://github.com/reallakshman19/XML_Compare_Utilities/issues/139"
    }
  ],
  "highRoi": [
    {
      "t": "Preserve original TARGET0 raw bytes and explicit, SHA-bound new-copy writer rules",
      "u": "https://github.com/reallakshman19/XML_Compare_Utilities/issues/139",
      "s": "proposed"
    }
  ],
  "future": [
    {
      "t": "Only separately Owner-authorized production replacement after integrated validation",
      "u": "https://github.com/reallakshman19/XML_Compare_Utilities/issues/139"
    }
  ],
  "intent": [
    {
      "t": "Normal literal/regex only within supported CII fixed fields; writer produces immutable new-copy TARGET1.",
      "u": "https://github.com/reallakshman19/XML_Compare_Utilities/issues/139"
    }
  ],
  "inputs": [
    {
      "t": "Authoritative current work packet and engineering scope",
      "u": "https://github.com/reallakshman19/XML_Compare_Utilities/issues/139"
    }
  ],
  "knownIssues": [
    {
      "t": "F01 reported mismatches, no independent latest-head byte custody + browser export result.",
      "u": "https://github.com/reallakshman19/XML_Compare_Utilities/issues/152",
      "s": "open"
    }
  ],
  "pending": [
    {
      "t": "Next actor must produce actual implementation/review receipts, not infer them from an open issue",
      "u": "https://github.com/reallakshman19/XML_Compare_Utilities/issues/152",
      "s": "waiting"
    }
  ]
}
